{
  "schema_version": "0.2.0",
  "scope": "Every active series in sources/catalog.csv plus the hand-curated production-critical set. Static economic metadata only; refresh outcomes live in the append-only event log (output/data_quality/refresh_events.jsonl).",
  "status_definitions": {
    "not_yet_released": "The cache contains every observation expected by the as-of date, while a later reference period is complete but its scheduled release date has not arrived.",
    "source_unavailable": "The source endpoint or upstream publication is unavailable at the latest attempted refresh.",
    "ingestion_failure": "The source was reachable, but retrieval, parsing, transformation, or persistence failed.",
    "validation_failure": "Data were retrieved but failed schema, range, uniqueness, timing, or other declared validation rules.",
    "stale_observation": "At least one observation should have been released by the as-of date but is absent from the monitored cache.",
    "manually_overridden": "A documented manual value currently supersedes the automated source.",
    "successfully_updated": "The monitored cache includes the latest reference period expected by the as-of date and no later failure overrides that success.",
    "unassessed": "Static registry fields use null until the monitoring view is built. Unassessed is never a dashboard status."
  },
  "series": [
    {
      "variable_name": "Peru real GDP growth",
      "internal_code": "g_pbiq",
      "provider_code": "PN02538AQ",
      "source_institution": "Banco Central de Reserva del Peru",
      "source_url": "https://estadisticas.bcrp.gob.pe/estadisticas/series/api",
      "frequency": "Q",
      "unit": "percent year over year, log change",
      "transformation": "X13 seasonal adjustment of the real GDP level, then 100 times the four-quarter log difference",
      "geographic_coverage": "Peru",
      "start_date": "1995-03-01",
      "release_calendar": {
        "rule": "period_end_plus_lag",
        "source": "assumed scalar lag in targets/peru_gdp.py"
      },
      "publication_lag_days": 51,
      "revision_policy": "Revisable national accounts; the production panel currently stores a latest-revised snapshot",
      "seasonal_adjustment_status": "Project-generated X13 adjustment estimated on the full cached sample",
      "vintage_availability": "Run snapshots exist, but historical source vintages are not used by the backtest",
      "expected_update_frequency": "quarterly",
      "current_availability_status": null,
      "ingestion_script": "targets/peru_gdp.py:refresh and legacy core/preprocess.py build",
      "downstream_models": [
        "Peru nowcast ladder",
        "Peru conditional BVAR",
        "Peru fan chart"
      ],
      "fallback_source": null,
      "validation_rules": {
        "unique_periods": true,
        "monotonic_periods": true,
        "allow_all_missing": false,
        "plausible_range": [
          -40,
          40
        ]
      },
      "last_successful_refresh": null,
      "known_issues": [
        "The automated refresh does not rebuild the spec3 panel",
        "The source catalog declares qoq_ann while the target code uses year-over-year growth",
        "Historical seasonal adjustment is full-sample rather than vintage-specific"
      ],
      "monitor": {
        "type": "target_panel",
        "target": "peru_gdp",
        "frame": "quarterly",
        "column": "g_pbiq",
        "path": "input/peru/quarterly_sa_spec3.parquet"
      },
      "required_for_publication": true
    },
    {
      "variable_name": "Peru monthly GDP proxy growth",
      "internal_code": "g_pbim_yoy",
      "provider_code": "PN01770AM",
      "source_institution": "Banco Central de Reserva del Peru",
      "source_url": "https://estadisticas.bcrp.gob.pe/estadisticas/series/api",
      "frequency": "M",
      "unit": "percent year over year, log change",
      "transformation": "X13 seasonal adjustment of monthly GDP level, then 100 times the twelve-month log difference",
      "geographic_coverage": "Peru",
      "start_date": "1995-01-01",
      "release_calendar": {
        "rule": "period_end_plus_lag",
        "source": "assumed scalar lag in targets/peru_gdp.py"
      },
      "publication_lag_days": 51,
      "revision_policy": "Revisable; latest-revised cache used in historical backtests",
      "seasonal_adjustment_status": "Project-generated X13 adjustment estimated on the full cached sample",
      "vintage_availability": "Run snapshots only for the production modeling panel",
      "expected_update_frequency": "monthly",
      "current_availability_status": null,
      "ingestion_script": "targets/peru_gdp.py and legacy core/preprocess.py build",
      "downstream_models": [
        "Bridge(leaders)",
        "P-MIDAS(leaders)",
        "Adaptive-IC"
      ],
      "fallback_source": "INEI monthly activity bulletins are archived but not wired into the production panel",
      "validation_rules": {
        "unique_periods": true,
        "monotonic_periods": true,
        "allow_all_missing": false,
        "plausible_range": [
          -80,
          80
        ]
      },
      "last_successful_refresh": null,
      "known_issues": [
        "The automated refresh reports cache age but does not rebuild this series",
        "Historical values contain final-vintage revisions and full-sample seasonal factors"
      ],
      "monitor": {
        "type": "target_panel",
        "target": "peru_gdp",
        "frame": "monthly",
        "column": "g_pbim_yoy",
        "path": "input/peru/monthly_panel_spec3.parquet"
      },
      "required_for_publication": true
    },
    {
      "variable_name": "Peru sector expectations, three months",
      "internal_code": "exp_sec3m",
      "provider_code": "PD38046AM",
      "source_institution": "Banco Central de Reserva del Peru",
      "source_url": "https://estadisticas.bcrp.gob.pe/estadisticas/series/api",
      "frequency": "M",
      "unit": "diffusion index",
      "transformation": "none",
      "geographic_coverage": "Peru",
      "start_date": "2002-06-01",
      "release_calendar": {
        "rule": "period_end_plus_lag",
        "source": "assumed scalar lag in Peru metadata"
      },
      "publication_lag_days": 7,
      "revision_policy": "Survey release; corrections are possible and no source-vintage archive is retained",
      "seasonal_adjustment_status": "not seasonally adjusted",
      "vintage_availability": "Run snapshots only",
      "expected_update_frequency": "monthly",
      "current_availability_status": null,
      "ingestion_script": "legacy Peru spec3 preprocess",
      "downstream_models": [
        "Bridge(leaders)",
        "P-MIDAS(leaders)",
        "Adaptive-IC"
      ],
      "fallback_source": null,
      "validation_rules": {
        "unique_periods": true,
        "monotonic_periods": true,
        "allow_all_missing": false,
        "plausible_range": [
          0,
          100
        ]
      },
      "last_successful_refresh": null,
      "known_issues": [
        "The automated refresh does not rebuild the model cache"
      ],
      "monitor": {
        "type": "target_panel",
        "target": "peru_gdp",
        "frame": "monthly",
        "column": "exp_sec3m",
        "path": "input/peru/monthly_panel_spec3.parquet"
      },
      "required_for_publication": true
    },
    {
      "variable_name": "Peru economy expectations, three months",
      "internal_code": "exp_eco3m",
      "provider_code": "PD38045AM",
      "source_institution": "Banco Central de Reserva del Peru",
      "source_url": "https://estadisticas.bcrp.gob.pe/estadisticas/series/api",
      "frequency": "M",
      "unit": "diffusion index",
      "transformation": "none",
      "geographic_coverage": "Peru",
      "start_date": "2002-04-01",
      "release_calendar": {
        "rule": "period_end_plus_lag",
        "source": "assumed scalar lag in Peru metadata"
      },
      "publication_lag_days": 7,
      "revision_policy": "Survey release; corrections are possible and no source-vintage archive is retained",
      "seasonal_adjustment_status": "not seasonally adjusted",
      "vintage_availability": "Run snapshots only",
      "expected_update_frequency": "monthly",
      "current_availability_status": null,
      "ingestion_script": "legacy Peru spec3 preprocess",
      "downstream_models": [
        "Bridge(leaders)",
        "P-MIDAS(leaders)",
        "Adaptive-IC",
        "Peru conditional BVAR"
      ],
      "fallback_source": null,
      "validation_rules": {
        "unique_periods": true,
        "monotonic_periods": true,
        "allow_all_missing": false,
        "plausible_range": [
          0,
          100
        ]
      },
      "last_successful_refresh": null,
      "known_issues": [
        "The medium-term forecast holds the latest value flat for eight quarters",
        "The automated refresh does not rebuild the model cache"
      ],
      "monitor": {
        "type": "target_panel",
        "target": "peru_gdp",
        "frame": "monthly",
        "column": "exp_eco3m",
        "path": "input/peru/monthly_panel_spec3.parquet"
      },
      "required_for_publication": true
    },
    {
      "variable_name": "Peru domestic cement consumption growth",
      "internal_code": "cem",
      "provider_code": "PD37967GM",
      "source_institution": "Banco Central de Reserva del Peru",
      "source_url": "https://estadisticas.bcrp.gob.pe/estadisticas/series/api",
      "frequency": "M",
      "unit": "percent year over year",
      "transformation": "none, source publishes growth",
      "geographic_coverage": "Peru",
      "start_date": "1994-01-01",
      "release_calendar": {
        "rule": "period_end_plus_lag",
        "source": "assumed scalar lag in Peru metadata"
      },
      "publication_lag_days": 51,
      "revision_policy": "Revisable; no source-vintage archive is retained",